{
  "auth_event_list_schema_version": "oa_auth_event_list.v1",
  "service_id": "nex-oa",
  "tenant_ref": {"type": "oa.tenant", "id": "tenant-1229"},
  "events": [
    {
      "event_schema_version": "oa_auth_event.v1",
      "event_id": "event-1229",
      "event_type": "LOGIN_SUCCEEDED",
      "outcome": "SUCCEEDED",
      "tenant_ref": {"type": "oa.tenant", "id": "tenant-1229"},
      "subject_ref": {"type": "oa.user", "id": "user-1229"},
      "credential_id": "credential-1229",
      "actor_ref": "nex.service:nex-ae-api",
      "request_id": "request-1229-login",
      "trace_id": "1234567890abcdef1234567890abcdef",
      "details": {"credential_status": "ACTIVE"},
      "occurred_at": "2026-10-01T00:00:00Z"
    }
  ],
  "count": 1,
  "request_id": "request-1229-list",
  "trace_id": "1234567890abcdef1234567890abcdef"
}
